{
  "tool": "shfmt",
  "version": "3.6.0",
  "timestamp": "2026-02-17T10:30:00+00:00",
  "exit_code": 0,
  "command": "shfmt -d src/",
  "summary": {
    "total_files": 1,
    "files_with_errors": 0,
    "error_count": 0,
    "warning_count": 0
  },
  "results": [
    {
      "file_path": "/workspace/test-fixtures/bash/shfmt/pass/src/clean.sh",
      "formatted": true,
      "diff_count": 0,
      "hunks": []
    }
  ]
}
